{
    "$schema": "http://json-schema.org/draft-07/schema#",
    "title": "Media Library schema for version configuration",
    "type": "object",
    "properties": {
        "version": {
            "type": "string"
        },
        "metadata": {
            "type": "object",
            "properties": {
                "architecture": {
                    "type": "string",
                    "enum": [
                        "hailo15h",
                        "hailo15l"
                    ]
                },
                "description": {
                    "type": "string"
                },
                "content_hash": {
                    "type": "string"
                },
                "generation_timestamp": {
                    "type": "string"
                }
            },
            "required": [
                "architecture",
                "description",
                "content_hash",
                "generation_timestamp"
            ]
        },
        "application_input_streams": {
            "type": "object",
            "properties": {
                "method": {
                    "type": "string"
                },
                "format": {
                    "type": "string"
                },
                "resolutions": {
                    "type": "array",
                    "items": {
                        "type": "object",
                        "properties": {
                            "stream_id": {
                                "type": "string"
                            },
                            "width": {
                                "type": "number"
                            },
                            "height": {
                                "type": "number"
                            },
                            "framerate": {
                                "type": "number"
                            },
                            "pool_max_buffers": {
                                "type": "number"
                            },
                            "scaling_mode": {
                                "type": "string",
                                "enum": [
                                    "STRETCH",
                                    "LETTERBOX_MIDDLE",
                                    "LETTERBOX_UP_LEFT",
                                    "SCALE_AND_CROP"
                                ]
                            }
                        },
                        "additionalProperties": false,
                        "required": [
                            "width",
                            "height",
                            "framerate",
                            "pool_max_buffers"
                        ]
                    }
                }
            },
            "additionalProperties": false,
            "required": [
                "method",
                "format",
                "resolutions"
            ]
        },
        "gmv": {
            "type": "object",
            "properties": {
                "source": {
                    "type": "string"
                },
                "frequency": {
                    "type": "number"
                }
            },
            "additionalProperties": false,
            "required": [
                "source",
                "frequency"
            ]
        },
        "optical_zoom": {
            "type": "object",
            "properties": {
                "enabled": {
                    "type": "boolean"
                },
                "magnification": {
                    "type": "number"
                },
                "max_dewarping_magnification": {
                    "type": "number"
                }
            },
            "additionalProperties": false,
            "required": [
                "magnification",
                "enabled"
            ]
        },
        "digital_zoom": {
            "type": "object",
            "properties": {
                "enabled": {
                    "type": "boolean"
                },
                "mode": {
                    "type": "string"
                },
                "magnification": {
                    "type": "number"
                },
                "roi": {
                    "type": "object",
                    "properties": {
                        "x": {
                            "type": "number"
                        },
                        "y": {
                            "type": "number"
                        },
                        "width": {
                            "type": "number"
                        },
                        "height": {
                            "type": "number"
                        }
                    },
                    "additionalProperties": false,
                    "required": [
                        "x",
                        "y",
                        "width",
                        "height"
                    ]
                }
            },
            "additionalProperties": false,
            "required": [
                "enabled",
                "mode",
                "magnification",
                "roi"
            ]
        },
        "motion_detection": {
            "type": "object",
            "properties": {
                "enabled": {
                    "type": "boolean"
                },
                "roi": {
                    "type": "object",
                    "properties": {
                        "x": {
                            "type": "number"
                        },
                        "y": {
                            "type": "number"
                        },
                        "width": {
                            "type": "number"
                        },
                        "height": {
                            "type": "number"
                        }
                    },
                    "additionalProperties": false,
                    "required": [
                        "x",
                        "y",
                        "width",
                        "height"
                    ]
                },
                "resolution": {
                    "type": "object",
                    "properties": {
                        "width": {
                            "type": "number"
                        },
                        "height": {
                            "type": "number"
                        },
                        "framerate": {
                            "type": "number"
                        },
                        "pool_max_buffers": {
                            "type": "number"
                        }
                    },
                    "additionalProperties": false,
                    "required": [
                        "width",
                        "height",
                        "framerate"
                    ]
                },
                "threshold": {
                    "type": "number",
                    "minimum": 0,
                    "maximum": 1
                },
                "sensitivity_level": {
                    "type": "string"
                },
                "buffer_pool_size": {
                    "type": "number",
                    "minimum": 0,
                    "default": 8
                }
            },
            "additionalProperties": false,
            "required": [
                "enabled",
                "roi",
                "resolution",
                "threshold",
                "sensitivity_level",
                "buffer_pool_size"
            ]
        },
        "rotation": {
            "type": "object",
            "properties": {
                "enabled": {
                    "type": "boolean"
                },
                "angle": {
                    "type": "string"
                }
            },
            "additionalProperties": false,
            "required": [
                "enabled",
                "angle"
            ]
        },
        "flip": {
            "type": "object",
            "properties": {
                "enabled": {
                    "type": "boolean"
                },
                "direction": {
                    "type": "string"
                }
            },
            "additionalProperties": false,
            "required": [
                "enabled",
                "direction"
            ]
        },
        "hailort": {
            "type": "object",
            "properties": {
                "device-id": {
                    "type": "string"
                },
                "use-hailort-service": {
                    "type": "boolean"
                }
            },
            "additionalProperties": false,
            "required": [
                "device-id"
            ]
        },
        "application_analytics": {
            "type": "object",
            "properties": {
                "detection": {
                    "type": "array",
                    "items": {
                        "type": "object",
                        "properties": {
                            "analytics_data_id": {
                                "type": "string"
                            },
                            "scaling_mode": {
                                "type": "string",
                                "enum": [
                                    "STRETCH",
                                    "LETTERBOX_MIDDLE",
                                    "LETTERBOX_UP_LEFT"
                                ]
                            },
                            "width": {
                                "type": "integer"
                            },
                            "height": {
                                "type": "integer"
                            },
                            "original_width_ratio": {
                                "type": "integer"
                            },
                            "original_height_ratio": {
                                "type": "integer"
                            },
                            "max_entries": {
                                "type": "integer"
                            },
                            "labels": {
                                "type": "array",
                                "items": {
                                    "type": "object",
                                    "properties": {
                                        "label": {
                                            "type": "string"
                                        },
                                        "id": {
                                            "type": "integer"
                                        }
                                    },
                                    "required": [
                                        "label",
                                        "id"
                                    ]
                                }
                            }
                        },
                        "required": [
                            "analytics_data_id",
                            "labels"
                        ],
                        "dependencies": {
                            "scaling_mode": [
                                "width",
                                "height",
                                "original_width_ratio",
                                "original_height_ratio",
                                "max_entries"
                            ],
                            "width": [
                                "scaling_mode",
                                "height",
                                "original_width_ratio",
                                "original_height_ratio",
                                "max_entries"
                            ],
                            "height": [
                                "scaling_mode",
                                "width",
                                "original_width_ratio",
                                "original_height_ratio",
                                "max_entries"
                            ],
                            "original_width_ratio": [
                                "scaling_mode",
                                "width",
                                "height",
                                "original_height_ratio",
                                "max_entries"
                            ],
                            "original_height_ratio": [
                                "scaling_mode",
                                "width",
                                "height",
                                "original_width_ratio",
                                "max_entries"
                            ],
                            "max_entries": [
                                "scaling_mode",
                                "width",
                                "height",
                                "original_width_ratio",
                                "original_height_ratio"
                            ]
                        },
                        "additionalProperties": false
                    }
                },
                "semantic_segmentation": {
                    "type": "array",
                    "items": {
                        "type": "object",
                        "properties": {
                            "analytics_data_id": {
                                "type": "string"
                            },
                            "scaling_mode": {
                                "type": "string",
                                "enum": [
                                    "STRETCH",
                                    "LETTERBOX_MIDDLE",
                                    "LETTERBOX_UP_LEFT"
                                ]
                            },
                            "width": {
                                "type": "integer"
                            },
                            "height": {
                                "type": "integer"
                            },
                            "original_width_ratio": {
                                "type": "integer"
                            },
                            "original_height_ratio": {
                                "type": "integer"
                            },
                            "max_entries": {
                                "type": "integer"
                            },
                            "labels": {
                                "type": "array",
                                "items": {
                                    "type": "object",
                                    "properties": {
                                        "label": {
                                            "type": "string"
                                        },
                                        "id": {
                                            "type": "integer"
                                        }
                                    },
                                    "required": [
                                        "label",
                                        "id"
                                    ]
                                }
                            }
                        },
                        "required": [
                            "analytics_data_id",
                            "labels"
                        ],
                        "dependencies": {
                            "scaling_mode": [
                                "width",
                                "height",
                                "original_width_ratio",
                                "original_height_ratio",
                                "max_entries"
                            ],
                            "width": [
                                "scaling_mode",
                                "height",
                                "original_width_ratio",
                                "original_height_ratio",
                                "max_entries"
                            ],
                            "height": [
                                "scaling_mode",
                                "width",
                                "original_width_ratio",
                                "original_height_ratio",
                                "max_entries"
                            ],
                            "original_width_ratio": [
                                "scaling_mode",
                                "width",
                                "height",
                                "original_height_ratio",
                                "max_entries"
                            ],
                            "original_height_ratio": [
                                "scaling_mode",
                                "width",
                                "height",
                                "original_width_ratio",
                                "max_entries"
                            ],
                            "max_entries": [
                                "scaling_mode",
                                "width",
                                "height",
                                "original_width_ratio",
                                "original_height_ratio"
                            ]
                        },
                        "additionalProperties": false
                    }
                }
            },
            "additionalProperties": false
        }
    },
    "required": [
        "version",
        "metadata",
        "application_input_streams",
        "optical_zoom",
        "digital_zoom",
        "rotation",
        "flip",
        "hailort"
    ],
    "additionalProperties": true,
    "$id": "application_settings_schema"
}