{
  "version": "4.0.0",
  "metadata": {
    "architecture": "hailo15h",
    "content_hash": "002668d12f0c62d0825b800ebaeed70556cab0c94894d992cbfbc58e994965b4",
    "description": "",
    "generation_timestamp": "2026-05-31T10:35:22.373121+00:00"
  },
  "application_input_streams": {
    "format": "IMAGE_FORMAT_NV12",
    "method": "INTERPOLATION_TYPE_BILINEAR",
    "resolutions": [
      {
        "framerate": 30,
        "height": 2160,
        "pool_max_buffers": 20,
        "stream_id": "sink0",
        "width": 3840
      }
    ]
  },
  "digital_zoom": {
    "enabled": false,
    "magnification": 1.0,
    "mode": "DIGITAL_ZOOM_MODE_ROI",
    "roi": {
      "height": 1800,
      "width": 2800,
      "x": 200,
      "y": 200
    }
  },
  "flip": {
    "direction": "FLIP_DIRECTION_HORIZONTAL",
    "enabled": false
  },
  "gmv": {
    "frequency": 0.0,
    "source": "isp"
  },
  "hailort": {
    "device-id": "device0"
  },
  "motion_detection": {
    "buffer_pool_size": 20,
    "enabled": true,
    "resolution": {
      "framerate": 30,
      "height": 480,
      "width": 640
    },
    "roi": {
      "height": 480,
      "width": 640,
      "x": 0,
      "y": 0
    },
    "sensitivity_level": "MEDIUM",
    "threshold": 0.5
  },
  "optical_zoom": {
    "enabled": true,
    "magnification": 1.0
  },
  "rotation": {
    "angle": "ROTATION_ANGLE_180",
    "enabled": false
  }
}
