{
  "version": "3.0.0",
  "metadata": {
    "architecture": "hailo15l",
    "content_hash": "587bf04c52e25ab0e9cf66546d044ad3e5dc6c33ed0ceafe76ba5a18b171936b",
    "description": "",
    "generation_timestamp": "2026-03-16T08:17:35.847905+00:00"
  },
  "application_input_streams": {
    "format": "IMAGE_FORMAT_NV12",
    "method": "INTERPOLATION_TYPE_BILINEAR",
    "resolutions": [
      {
        "framerate": 30,
        "height": 1944,
        "pool_max_buffers": 12,
        "width": 2592
      },
      {
        "framerate": 30,
        "height": 720,
        "pool_max_buffers": 12,
        "width": 1280
      }
    ]
  },
  "digital_zoom": {
    "enabled": false,
    "magnification": 1.0,
    "mode": "DIGITAL_ZOOM_MODE_ROI",
    "roi": {
      "height": 1800,
      "width": 2800,
      "x": 200,
      "y": 200
    }
  },
  "flip": {
    "direction": "FLIP_DIRECTION_HORIZONTAL",
    "enabled": false
  },
  "gmv": {
    "frequency": 0.0,
    "source": "isp"
  },
  "hailort": {
    "device-id": "device0"
  },
  "motion_detection": {
    "buffer_pool_size": 8,
    "enabled": false,
    "resolution": {
      "framerate": 30,
      "height": 480,
      "width": 640
    },
    "roi": {
      "height": 480,
      "width": 640,
      "x": 0,
      "y": 0
    },
    "sensitivity_level": "MEDIUM",
    "threshold": 0.5
  },
  "optical_zoom": {
    "enabled": true,
    "magnification": 1.0
  },
  "rotation": {
    "angle": "ROTATION_ANGLE_180",
    "enabled": false
  }
}
