{
  "version": "3.0.0",
  "metadata": {
    "architecture": "hailo15h",
    "content_hash": "bb4f807d1f794fa8a61c8fa78517a988e983929ff2a322e392f0e6e5b7f322bf",
    "description": "",
    "generation_timestamp": "2026-02-24T14:32:59.898268+00:00"
  },
  "application_input_streams": {
    "format": "IMAGE_FORMAT_NV12",
    "method": "INTERPOLATION_TYPE_BILINEAR",
    "resolutions": [
      {
        "framerate": 30,
        "height": 2160,
        "pool_max_buffers": 20,
        "stream_id": "sink0",
        "width": 3840
      },
      {
        "framerate": 30,
        "height": 384,
        "pool_max_buffers": 20,
        "stream_id": "detection_ai",
        "width": 640
      }
    ]
  },
  "digital_zoom": {
    "enabled": false,
    "magnification": 1.0,
    "mode": "DIGITAL_ZOOM_MODE_MAGNIFICATION",
    "roi": {
      "height": 1800,
      "width": 2800,
      "x": 200,
      "y": 200
    }
  },
  "flip": {
    "direction": "FLIP_DIRECTION_NONE",
    "enabled": false
  },
  "gmv": {
    "frequency": 0.0,
    "source": "isp"
  },
  "hailort": {
    "device-id": "device0"
  },
  "motion_detection": {
    "buffer_pool_size": 8,
    "enabled": false,
    "resolution": {
      "framerate": 30,
      "height": 480,
      "width": 640
    },
    "roi": {
      "height": 480,
      "width": 640,
      "x": 0,
      "y": 0
    },
    "sensitivity_level": "MEDIUM",
    "threshold": 0.5
  },
  "optical_zoom": {
    "enabled": false,
    "magnification": 1.0,
    "max_dewarping_magnification": 3.0
  },
  "rotation": {
    "angle": "ROTATION_ANGLE_0",
    "enabled": false
  }
}
