{
  "version": "4.0.0",
  "metadata": {
    "architecture": "hailo15l",
    "content_hash": "ed94b99a65f82d9f76f3e06463bdbd4614ba76767878726cfb6786efdc0f1df9",
    "description": "",
    "generation_timestamp": "2026-05-31T10:35:20.501005+00:00"
  },
  "application_input_streams": {
    "format": "IMAGE_FORMAT_NV12",
    "method": "INTERPOLATION_TYPE_BILINEAR",
    "resolutions": [
      {
        "framerate": 30,
        "height": 1944,
        "pool_max_buffers": 12,
        "scaling_mode": "STRETCH",
        "stream_id": "sink0",
        "width": 2592
      },
      {
        "framerate": 30,
        "height": 720,
        "pool_max_buffers": 12,
        "scaling_mode": "STRETCH",
        "stream_id": "sink1",
        "width": 1280
      },
      {
        "framerate": 30,
        "height": 1080,
        "pool_max_buffers": 15,
        "scaling_mode": "STRETCH",
        "stream_id": "sink2",
        "width": 1920
      }
    ]
  },
  "digital_zoom": {
    "enabled": false,
    "magnification": 1.0,
    "mode": "DIGITAL_ZOOM_MODE_MAGNIFICATION",
    "roi": {
      "height": 1300,
      "width": 2300,
      "x": 200,
      "y": 200
    }
  },
  "flip": {
    "direction": "FLIP_DIRECTION_HORIZONTAL",
    "enabled": false
  },
  "gmv": {
    "frequency": 0.0,
    "source": "isp"
  },
  "hailort": {
    "device-id": "device0"
  },
  "motion_detection": {
    "buffer_pool_size": 8,
    "enabled": false,
    "resolution": {
      "framerate": 30,
      "height": 480,
      "width": 640
    },
    "roi": {
      "height": 480,
      "width": 640,
      "x": 0,
      "y": 0
    },
    "sensitivity_level": "MEDIUM",
    "threshold": 0.5
  },
  "optical_zoom": {
    "enabled": true,
    "magnification": 1.0
  },
  "rotation": {
    "angle": "ROTATION_ANGLE_180",
    "enabled": false
  }
}
