{
  "version": "4.0.0",
  "metadata": {
    "architecture": "hailo15l",
    "content_hash": "57c38646a61b4261df3eafc94e94c0ec602f169011da0acf51d8ad9aa2989c79",
    "description": "",
    "generation_timestamp": "2026-06-01T12:09:12.240575+00:00"
  },
  "application_analytics": {
    "semantic_segmentation": [
      {
        "analytics_data_id": "dpm_overflow_detection",
        "height": 1080,
        "labels": [
          {
            "id": 1,
            "label": "person_face"
          },
          {
            "id": 0,
            "label": "vehicle"
          }
        ],
        "max_entries": 3,
        "original_height_ratio": 9,
        "original_width_ratio": 16,
        "scaling_mode": "LETTERBOX_MIDDLE",
        "width": 1920
      }
    ]
  },
  "application_input_streams": {
    "format": "IMAGE_FORMAT_NV12",
    "method": "INTERPOLATION_TYPE_BILINEAR",
    "resolutions": [
      {
        "framerate": 30,
        "height": 2160,
        "pool_max_buffers": 12,
        "stream_id": "sink0",
        "width": 3840
      },
      {
        "framerate": 30,
        "height": 720,
        "pool_max_buffers": 12,
        "stream_id": "dpm_sink1",
        "width": 1280
      },
      {
        "framerate": 30,
        "height": 1080,
        "pool_max_buffers": 30,
        "stream_id": "dpm_sink2",
        "width": 1920
      }
    ]
  },
  "digital_zoom": {
    "enabled": false,
    "magnification": 1.0,
    "mode": "DIGITAL_ZOOM_MODE_ROI",
    "roi": {
      "height": 1800,
      "width": 2800,
      "x": 200,
      "y": 200
    }
  },
  "flip": {
    "direction": "FLIP_DIRECTION_HORIZONTAL",
    "enabled": false
  },
  "gmv": {
    "frequency": 0.0,
    "source": "isp"
  },
  "hailort": {
    "device-id": "device0"
  },
  "motion_detection": {
    "buffer_pool_size": 8,
    "enabled": false,
    "resolution": {
      "framerate": 30,
      "height": 480,
      "width": 640
    },
    "roi": {
      "height": 480,
      "width": 640,
      "x": 0,
      "y": 0
    },
    "sensitivity_level": "MEDIUM",
    "threshold": 0.5
  },
  "optical_zoom": {
    "enabled": true,
    "magnification": 1.0
  },
  "rotation": {
    "angle": "ROTATION_ANGLE_180",
    "enabled": false
  }
}
